Company Name,Website
AYA Bank,https://www.ayabank.com
BAIDURI BANK BERHAD,https://www.baiduri.com.bn
Bank Islam Brunei Darussalam Berhad,https://www.bibd.com.bn
Brunei Gas Carriers Sdn Bhd,https://www.bgc.com.bn
BRUNEI METHANOL COMPANY SDN BHD,https://www.brunei-methanol.com
Jabatan Perdana Menteri,https://www.pmo.gov.bn
MOTTAMA HOLDINGS LTD,https://www.mottamaholdings.com
MUARA MARITIMES SERVICES,https://www.muaramaritimeservices.com
PERBADANAN TABUNG AMANAH ISLAM BRUNEI,https://www.taib.com.bn
SATIUS CO PTE. LTD.,https://www.satius.com.sg
SHWE TAUNG GROUP OF COMPANIES,https://www.shwetaunggroup.com
YOMA BANK LIMITED,https://www.yomabank.com
ARMSTRONG INDUSTRIAL CORPORATION LTD,https://www.armstrong-world.com
BEYONICS TECHNOLOGY LTD,https://www.beyonics.com
BRIDGESTONE ASIA PACIFIC PTE LTD,https://www.bridgestone.com.sg
CEI Pte Ltd,https://www.cei.com.sg
Dou Yee International,https://www.douyee.com
ESCO MICRO PTE LTD,https://www.escomicro.com
ESPRESSIF INC.,https://www.espressif.com
Hoya Vision Care,https://www.hoyavision.com
Interplex Precision Technology (Singapore) Pte. Ltd.,https://www.interplex.com
JEBSEN & JESSEN (SEA) PTE LTD,https://www.jjsea.com
MAKINO ASIA PTE LTD,https://www.makino.com.sg
MEIBAN INTERNATIONAL PTE LTD,https://www.meiban.com
MFS TECHNOLOGY SINGAPORE PTE LTD,https://www.mfstechnology.com
MMI HOLDINGS LTD,https://www.mmi-holdings.com
NANOFILM,https://www.nanofilm.com.sg
NATSTEEL HOLDINGS PTE LTD,https://www.natsteel.com.sg
PCI LTD,https://www.pciltd.com.sg
SHIMANO SINGAPORE PTE LTD,https://www.shimano.com.sg
SINGAPORE AERO ENGINE SERVICES PTE LTD,https://www.singaporeaero.com.sg
Sivantos Pte Ltd,https://www.sivantos.com
SUMITOMO CHEMICAL SINGAPORE PTE LTD,https://www.sumitomo-chem.co.jp/english
SVM SOLUTIONS AND TECHNOLOGIES PTE LTD,https://www.svmsolution.com
TECAN ASIA PTE. LTD.,https://www.tecan.com
UNITED TEST AND ASSEMBLY CENTRE LTD,https://www.utacgroup.com
VENTURE CORPORATION LTD,https://www.venture.com.sg
VOLEX GROUP PLC,https://www.volex.com
ACCOR SA,https://www.accor.com
AirTrunk Pte Ltd,https://www.airtrunk.com
ALLPROPERTY MEDIA PTE LTD,https://www.allproperty.com.sg
ASCENT FUNDS SERVICES PTE LTD,https://www.ascentfundservices.com
BANK OF CHINA AVIATION,https://www.bankofchina.com/sg/
BANYAN TREE HOTELS & RESORTS PTE LTD,https://www.banyantree.com
BOARDROOM LTD,https://www.boardroomlimited.com
C & P HOLDINGS PTE LTD,https://www.cnpholdings.com.sg
CIMB-GK SECURITIES PTE LTD,https://www.cimb.com
CloudPay Asia Pte Ltd.,https://www.cloudpay.com
CMA CGM Asia Pacific Limited,https://www.cma-cgm.com
COGENT HOLDINGS LTD,https://www.cogentholdings.com
Collinson Group,https://www.collinsongroup.com
COMO Hotels & Resorts (Asia) Pte Ltd,https://www.comohotels.com
EQUIS FUNDS GROUP PTE LTD,https://www.equisfg.com
FOO KON TAN LLP,https://www.fookontan.com
G&M PTE LTD,https://www.gandm.com.sg
GENTING INTERNATIONAL SINGAPORE PTE LTD,https://www.rwsentosa.com
Halza Pte Ltd,https://www.halza.com
International baccalaureate,https://www.ibo.org
JAC SINGAPORE PTE LTD,https://www.jac-recruitment.sg
KUMON ASIA & OCEANIA PTE LTD,https://www.kumon.com.sg
"Mizuho Bank, Ltd.",https://www.mizuhogroup.com/singapore
NMG FINANCIAL SERVICES CONSULTING PTE LTD,https://www.nmg-group.com
Pan Pacific Hotels & Resorts Pte Ltd,https://www.panpacific.com
PAVILION ENERGY MANAGEMENT PTE LTD,https://www.pavilionenergy.com
PERSOLKELLY Pte Ltd,https://www.persolkelly.com
PHILLIP CAPITAL PTE LTD,https://www.phillip.com.sg
RAJAH & TANN LLP,https://www.rajahtann.com
SPH MEDIA LIMITED,https://www.sph.com.sg
Sumitomo Mitsui Banking,https://www.smbc.co.jp/global
The Bank of Tokyo-Mitsubishi UFJ,https://www.bk.mufg.jp/global
THE LEARNING LAB,https://www.thelearninglab.com.sg
WILMAR INTERNATIONAL LIMITED,https://www.wilmar-international.com
WORLD TABLE TENNIS PTE LTD,https://www.worldtabletennis.com
ASPIAL CORPORATION LTD,https://www.aspial.com
BEN LINE AGENCIES SINGAPORE PTE LTD,https://www.benlineagencies.com
BW MARITIME PTE LTD,https://www.bw-group.com
CHARLES & KEITH SINGAPORE PTE LTD,https://www.charleskeith.com
CJ LOGISTICS ASIA PTE LTD,https://www.cjlogistics.com
COURTS SINGAPORE LTD,https://www.courts.com.sg
DFS VENTURE SINGAPORE PTE LTD,https://www.dfs.com
DHL EXPRESS SINGAPORE PTE LTD,https://www.dhl.com.sg
DYSTAR SINGAPORE PTE LTD,https://www.dystar.com
EU YAN SANG INTERNATIONAL LTD,https://www.euyansang.com
Executive Ship Management Pte Ltd,https://www.executiveship.com
Global Logistic Properties Limited,https://www.glprop.com
GOODPACK LIMITED,https://www.goodpack.com
Ikano Pte LTD,https://www.ikanoretail.com
KUOK SINGAPORE LIMITED,https://www.kuokgroup.com
LUXASIA PTE LTD,https://www.luxasia.com
MAPLETREE INVESTMENT PTE LTD,https://www.mapletree.com.sg
MENTOR MEDIA LTD,https://www.mentormedia.com
OSIM INTERNATIONAL LTD,https://www.osim.com
PACIFIC INTERNATIONAL LINES PTE LTD,https://www.pilship.com
Petredec Limited,https://www.petredec.com
Razer (Asia-Pacific) Pte Ltd,https://www.razer.com
Rhenus Logistics Holding Asia,https://www.rhenus.com/en/sg
SEA CONSORTIUM PTE LTD,https://www.seacons.com
SWIRE PACIFIC OFFSHORE SERVICES PTE LTD,https://www.swirespo.com
TECK WAH INDUSTRIAL CO LTD,https://www.teckwah.com.sg
Tes-Amm (Singapore) Pte Ltd,https://www.tes-amm.com
THE HOUR GLASS LTD,https://www.thehourglass.com
THOME SHIP MANAGEMENT PTE LTD,https://www.thome.com.sg
WING TAI HOLDINGS LTD,https://www.wingtaiasia.com.sg
YCH GROUP PTE LTD,https://www.ych.com
YTL PowerSeraya Pte. Limited,https://www.ytlpowerseraya.com.sg
ASM Front-End Manufacturing Pte Ltd,https://www.asm.com
Beauty One International,https://www.beautyone.com.sg
BORNEO MOTORS SINGAPORE PTE LTD,https://www.borneomotors.com.sg
CHIP ENG SENG CONTRACTORS (1988) PTE LTD,https://www.chipengseng.com.sg
ConnectedLife Pte Ltd,https://www.connectedlife.io
CORDLIFE PTE LTD,https://www.cordlife.com
CPG CORPORATION PTE LTD,https://www.cpgcorp.com.sg
directasia,https://www.directasia.com
DP ARCHITECTS PTE LTD,https://www.dpa.com.sg
DYSON OPERATIONS PTE LTD,https://www.dyson.com.sg
Exyte,https://www.exyte.net
FAR EAST ORGANIZATION CENTRE PTE LTD,https://www.fareast.com.sg
FULLERTON HEALTHCARE GROUP PTE LTD,https://www.fullertonhealth.com
GOLDBELL ENGINEERING PTE LTD,https://www.goldbell.com.sg
IHH Healthcare Singapore,https://www.ihhhealthcare.com
KULICKE & SOFFA (SEA) PTE LTD,https://www.kns.com
LOGOS Property,https://www.logosproperty.com
MARINA CENTRE HOLDINGS PTE LTD,https://www.marinacentre.com.sg
Maxeon Solar Pte Ltd,https://www.maxeon.com
MOUNT ALVERNIA HOSPITAL,https://www.mtalvernia.sg
MSIG HOLDINGS (ASIA) PTE LTD,https://www.msig.com.sg
OBAYASHI CORPORATION,https://www.obayashi.co.jp/en
PacificLight Power Pte Ltd,https://www.pacificlight.com.sg
Plant Engineering Services Pte Ltd,https://www.plantengineering.com.sg
RAFFLES MEDICAL GROUP,https://www.rafflesmedicalgroup.com
REC Solar Pte. Ltd.,https://www.recgroup.com
SENOKO POWER LTD,https://www.senokoenergy.com
SINGAPORE PETROLEUM COMPANY,https://www.spc.com.sg
Singapore Refining Company Pte Ltd,https://www.src.com.sg
Singlife,https://www.singlife.com
SYSMEX ASIA PACIFIC PTE LTD,https://www.sysmex.com.sg
TANCHONG.COM PTE LTD,https://www.tanchong.com
The Farrer Park Company,https://www.farrerpark.com
TOKIO MARINE ASSET MANAGEMENT INTERNATIONAL PTE LTD,https://www.tokiomarineam.com
Trans Eurokars Pte Ltd,https://www.eurokars.com.sg
TUAS POWER LTD,https://www.tuaspower.com.sg
United Engineers Ltd,https://www.uel.sg
WEARNES AUTOMOTIVE PTE LTD,https://www.wearnesauto.com
Woh Hup Holdings Pte Ltd,https://www.wohhup.com
ADKNOWLEDGE ASIA PACIFIC PTE LTD,https://www.adknowledge.com
AVER ASIA SINGAPORE PTE LTD,https://www.averasia.com
BERGE BULK SINGAPORE PTE LTD,https://www.bergebulk.com
CHARLES MONAT ASSOCIATES PTE LTD,https://www.monat.com
DLT Singapore Pte Ltd,https://www.dlt.sg
Imperial Treasure Restaurant Group,https://www.imperialtreasure.com
Lighthouse Canton Pte Ltd,https://www.lighthouse-canton.com
NAVIG8 ASIA PTE LTD,https://www.navig8group.com
OMNI Remotes,https://www.omniremotes.com
Pokka corporation(s) Pte Ltd,https://www.pokka.com.sg
ROTARY ENGINEERING LTD,https://www.rotaryeng.com.sg
SANKYU SINGAPORE PTE LTD,https://www.sankyu.com.sg
TANKER PACIFIC MANAGEMENT SINGAPORE PTE LTD,https://www.tankerpacific.com
Technipnet SAS,https://www.technipfmc.com
TOUCH COMMUNITY SERVICES LTD,https://www.touch.org.sg
TRIPLE PTE LTD,https://www.triple.sg
WONG PARTNERSHIP,https://www.wongpartnership.com
Bajaj Finance Limited,https://www.bajajfinserv.in
HDFC Ltd.,https://www.hdfc.com
Shriram Transport Finance Company,https://www.stfc.in
Muthoot Finance Ltd.,https://www.muthootfinance.com
Mahindra & Mahindra Financial Services Limited,https://www.mahindrafinance.com
L&T Finance Holdings Limited,https://www.ltfs.com
Aditya Birla Finance Limited,https://www.adityabirlacapital.com
Cholamandalam Investment and Finance Company,https://www.cholamandalam.com
Tata Capital Financial Services Limited,https://www.tatacapital.com
Sundaram Finance Limited,https://www.sundaramfinance.in
Manappuram Finance Limited,https://www.manappuram.com
Magma Fincorp Limited,https://www.magma.co.in
Muthoot Fincorp Limited,https://www.muthootfincorp.com
HDB Financial Services,https://www.hdbfs.com
Fullerton India Credit Company Limited,https://www.fullertonindia.com
Indiabulls Housing Finance Limited,https://www.indiabullshomeloans.com
PNB Housing Finance Limited,https://www.pnbhousing.com
Reliance Capital Limited,https://www.reliancecapital.co.in
SREI Infrastructure Finance Limited,https://www.srei.com
Edelweiss Financial Services Limited,https://www.edelweissfin.com
IIFL Finance Limited,https://www.iifl.com
JM Financial Limited,https://www.jmfl.com
Motilal Oswal Financial Services Limited,https://www.motilaloswal.com
Capital First Limited,https://www.capitalfirst.com
AU Small Finance Bank,https://www.aubank.in
Ujjivan Financial Services Limited,https://www.ujjivan.com
Equitas Holdings Limited,https://www.equitas.in
Shriram City Union Finance Limited,https://www.shriramcity.in
Hinduja Leyland Finance Limited,https://www.hindujaleylandfinance.com
Muthoot Capital Services Limited,https://www.muthootcap.com
LIC Housing Finance Limited,https://www.lichousing.com
Dewan Housing Finance Corporation Limited (DHFL),https://www.dhfl.com
Can Fin Homes Limited,https://www.canfinhomes.com
Repco Home Finance Limited,https://www.repcohome.com
GIC Housing Finance Limited,https://www.gichfindia.com
ICICI Home Finance Company Limited,https://www.icicihfc.com
Piramal Capital & Housing Finance Limited,https://www.piramalfinance.com
India Infoline Finance Limited,https://www.iiflfinance.com
Religare Finvest Limited,https://www.religarefinvest.com
MAS Financial Services Limited,https://www.mas.co.in
Capri Global Capital Limited,https://www.capriglobal.in
Aavas Financiers Limited,https://www.aavas.in
Home First Finance Company India Limited,https://www.homefirstindia.com
DBS Bank Ltd,https://www.dbs.com.sg
Oversea-Chinese Banking Corporation (OCBC),https://www.ocbc.com
United Overseas Bank (UOB),https://www.uobgroup.com
Hong Leong Finance Limited,https://www.hlf.com.sg
Singapura Finance Ltd,https://www.singapurafinance.com.sg
Standard Chartered Bank (Singapore),https://www.sc.com/sg
Citibank Singapore Limited,https://www.citibank.com.sg
HSBC Bank (Singapore) Limited,https://www.hsbc.com.sg
Maybank Singapore Limited,https://www.maybank2u.com.sg
RHB Bank Berhad Singapore,https://www.rhbgroup.com/singapore
Bank of China Limited Singapore Branch,https://www.bankofchina.com/sg
Industrial and Commercial Bank of China Limited Singapore Branch,https://www.icbc.com.sg
Sumitomo Mitsui Banking Corporation Singapore Branch,https://www.smbc.co.jp/global
Mizuho Bank (Singapore Branch),https://www.mizuhogroup.com/singapore
BNP Paribas Singapore,https://www.bnpparibas.com.sg
ANZ Banking Group Limited Singapore Branch,https://www.anz.com.sg
Deutsche Bank AG Singapore,https://www.db.com/singapore
Credit Suisse AG Singapore Branch,https://www.credit-suisse.com/sg
J.P. Morgan Chase Bank N.A. Singapore Branch,https://www.jpmorgan.com/singapore
Barclays Bank PLC Singapore Branch,https://www.barclays.com.sg
UBS AG Singapore Branch,https://www.ubs.com/sg
Nomura Singapore Limited,https://www.nomura.com/singapore
Macquarie Bank Limited Singapore Branch,https://www.macquarie.com/sg
Phillip Securities Pte Ltd,https://www.poems.com.sg
KGI Securities (Singapore) Pte Ltd,https://www.kgieworld.sg
PT Adira Dinamika Multi Finance Tbk,https://www.adira.co.id
PT Federal International Finance (FIFGROUP),https://www.fifgroup.co.id
PT BFI Finance Indonesia Tbk,https://www.bfi.co.id
PT Astra Sedaya Finance,https://www.astrasedaya.id
PT Mandala Multifinance Tbk,https://www.mandalafinance.com
PT Wahana Ottomitra Multiartha Tbk (WOM Finance),https://www.womfinance.com
PT Clipan Finance Indonesia Tbk,https://www.clipan.co.id
PT Indomobil Finance Indonesia,https://www.indomobilfinance.com
PT Summit Oto Finance,https://www.sof.co.id
PT Verena Multi Finance Tbk,https://www.verena.co.id
PT Panin Financial Tbk,https://www.paninfinancial.co.id
PT Bank Negara Indonesia (BNI) Finance,https://www.bnifinance.co.id
PT Bank Rakyat Indonesia (BRI) Finance,https://www.brifinance.co.id
PT Bank Central Asia (BCA) Finance,https://www.bcafinance.co.id
PT Bank Danamon Indonesia Tbk,https://www.danamon.co.id
PT Bank Mandiri Tbk,https://www.bankmandiri.co.id
PT Bank CIMB Niaga Tbk,https://www.cimbniaga.co.id
PT Bank Permata Tbk,https://www.permatabank.com
PT Bank Negara Indonesia (BNI) Finance,https://www.bnifinance.co.id
PT Maybank Indonesia Finance,https://www.maybank.co.id
PT KEB Hana Bank Indonesia Finance,https://www.hanabank.co.id
PT Bank Bukopin Tbk,https://www.bukopin.co.id
PT Bank Sinarmas Tbk,https://www.banksinarmas.com
PT Bank Mega Tbk,https://www.bankmega.com
PT Bank Tabungan Negara (BTN) Finance,https://www.btn.co.id
Chailease Holding Company Limited,https://www.chailease.com.tw
SinoPac Leasing Corporation,https://www.sinopac.com
Taiwan Acceptance Corporation,https://www.tac.com.tw
"Fubon Leasing Co., Ltd.",https://www.fubonleasing.com.tw
"KGI Securities Co., Ltd.",https://www.kgi.com
"Yuanta Securities Co., Ltd.",https://www.yuanta.com
Cathay Securities Corporation,https://www.cathaysec.com.tw
"Mega International Commercial Bank Co., Ltd.",https://www.megabank.com.tw
"CTBC Bank Co., Ltd.",https://www.ctbcbank.com
"Taishin International Bank Co., Ltd.",https://www.taishinbank.com.tw
"E.Sun Securities Investment Trust Co., Ltd.",https://www.esunbank.com.tw
"Sinopac Leasing Co., Ltd.",https://www.sinopac.com
First Securities Inc.,https://www.firstsec.com.tw
Bank of Taiwan,https://www.bot.com.tw
China Development Financial Holding Corporation,https://www.cdibh.com
Jih Sun Financial Holding Company,https://www.jsun.com
Land Bank of Taiwan,https://www.landbank.com.tw
Taiwan Cooperative Bank,https://www.tcb-bank.com.tw
"Hua Nan Financial Holdings Co., Ltd.",https://www.hnfhc.com.tw
Citibank Taiwan Ltd.,https://www.citibank.com.tw
United Overseas Bank Ltd. (UOB) - Taiwan Branch,https://www.uob.com.tw
Standard Chartered Bank (Taiwan),https://www.sc.com/tw
Chang Hwa Bank,https://www.chb.com.tw
"Fubon Financial Holding Co., Ltd.",https://www.fubon.com
Bank of Panhsin,https://www.panhsinbank.com.tw
Ayudhya Capital Auto Lease Public Company Limited (Krungsri Auto),https://www.krungsriauto.com
Thanachart Capital Public Company Limited,https://www.thanachart.co.th
Srisawad Corporation Public Company Limited,https://www.meebaanmeerod.com
Muangthai Capital Public Company Limited,https://www.muangthaicap.com
Ngern Tid Lor Public Company Limited (TIDLOR),https://www.tidlor.com
Asia Sermkij Leasing Public Company Limited,https://www.ask.co.th
Ratchthani Leasing Public Company Limited,https://www.ratchthani.com
Mida Leasing Public Company Limited,https://www.midaleasing.com
Bangkok Commercial Asset Management Public Company Limited,https://www.bam.co.th
Thitikorn Public Company Limited,https://www.tk.co.th
"ICBC Leasing (Thailand) Co., Ltd.",https://www.icbcleasing.co.th
Siam Commercial Bank - SCB Leasing,https://www.scbleasing.co.th
Kiatnakin Phatra Financial Group,https://www.kkpfg.com
Krungthai Card Public Company Limited (KTC),https://www.ktc.co.th
TISCO Financial Group Public Company Limited,https://www.tisco.co.th
"Bangkok Bank Leasing Co., Ltd.",https://www.bangkokbank.com
Thai Group Leasing Public Company Limited,https://www.thaithougroup.com
CIMB Thai Bank Public Company Limited,https://www.cimbthai.com
"Asia Insurance Co., Ltd.",https://www.asiainsurance.co.th
TMBThanachart Bank Public Company Limited,https://www.ttbbank.com
"Siam City Cement Leasing Co., Ltd.",https://www.siamcitycement.com
VGI Global Media Public Company Limited,https://www.vgi.co.th
Thailand Finance Public Company Limited,https://www.thaithamrong.com
Financial Institutions Development Fund,https://www.bot.or.th
Thai Military Bank Public Company Limited (TMB),https://www.ttbbank.com
FE Credit,https://www.fecredit.com.vn
Home Credit Vietnam,https://www.homecredit.vn
HD Saison Finance Company,https://www.hdsaison.com.vn
Mcredit,https://www.mcredit.com.vn
VietCredit Finance Company,https://www.vietcredit.vn
Pocfin,https://www.pocfin.com.vn
Viettel Post Finance,https://www.viettelmoney.vn
VIB Finance,https://www.vib.com.vn
Lotte Finance Vietnam,https://www.lottefinance.vn
Mirae Asset Finance,https://www.mafc.com.vn
ABBANK Finance,https://www.abbank.vn
VPBank Finance,https://www.vpb.com.vn
SeABank Finance,https://www.seabank.com.vn
Dai-ichi Life Vietnam,https://www.dai-ichi-life.com.vn
ACLEDA Finance,https://www.acledabank.com.vn
Shinhwa Finance,https://www.shinhwafinance.com.vn
OCB Finance,https://www.ocb.com.vn
SCB Finance Vietnam,https://www.scb.com.vn
BaoViet Finance,https://www.baovietbank.vn
MB Finance,https://www.mbbank.com.vn
ACB Finance,https://www.acb.com.vn
Sacombank Finance,https://www.sacombank.com.vn
Techcom Finance,https://www.techcombank.com.vn
VietinBank Finance,https://www.vietinbank.vn
DongA Bank Finance,https://www.dongabank.com.vn
Bajaj Finance Limited,https://www.bajajfinserv.in
HDFC Ltd.,https://www.hdfc.com
Shriram Transport Finance Company,https://www.stfc.in
Muthoot Finance Ltd.,https://www.muthootfinance.com
Mahindra & Mahindra Financial Services Limited,https://www.mahindrafinance.com
L&T Finance Holdings Limited,https://www.ltfs.com
Aditya Birla Finance Limited,https://www.adityabirlacapital.com
Cholamandalam Investment and Finance Company,https://www.cholamandalam.com
Tata Capital Financial Services Limited,https://www.tatacapital.com
Sundaram Finance Limited,https://www.sundaramfinance.in
Manappuram Finance Limited,https://www.manappuram.com
Magma Fincorp Limited,https://www.magma.co.in
Muthoot Fincorp Limited,https://www.muthootfincorp.com
HDB Financial Services,https://www.hdbfs.com
Fullerton India Credit Company Limited,https://www.fullertonindia.com
Indiabulls Housing Finance Limited,https://www.indiabullshomeloans.com
PNB Housing Finance Limited,https://www.pnbhousing.com
Reliance Capital Limited,https://www.reliancecapital.co.in
SREI Infrastructure Finance Limited,https://www.srei.com
Edelweiss Financial Services Limited,https://www.edelweissfin.com
IIFL Finance Limited,https://www.iifl.com
JM Financial Limited,https://www.jmfl.com
Motilal Oswal Financial Services Limited,https://www.motilaloswal.com
Capital First Limited,https://www.capitalfirst.com
AU Small Finance Bank,https://www.aubank.in
Ujjivan Financial Services Limited,https://www.ujjivan.com
Equitas Holdings Limited,https://www.equitas.in
Shriram City Union Finance Limited,https://www.shriramcity.in
Hinduja Leyland Finance Limited,https://www.hindujaleylandfinance.com
Muthoot Capital Services Limited,https://www.muthootcap.com
LIC Housing Finance Limited,https://www.lichousing.com
Dewan Housing Finance Corporation Limited (DHFL),https://www.dhfl.com
Can Fin Homes Limited,https://www.canfinhomes.com
Repco Home Finance Limited,https://www.repcohome.com
GIC Housing Finance Limited,https://www.gichfindia.com
ICICI Home Finance Company Limited,https://www.icicihfc.com
Piramal Capital & Housing Finance Limited,https://www.piramalfinance.com
India Infoline Finance Limited,https://www.iiflfinance.com
Religare Finvest Limited,https://www.religarefinvest.com
MAS Financial Services Limited,https://www.mas.co.in
Capri Global Capital Limited,https://www.capriglobal.in
Aavas Financiers Limited,https://www.aavas.in
Home First Finance Company India Limited,https://www.homefirstindia.com